{
  "crew_member_id": "FMARS-C18-2025-CM06",
  "mission_id": "FMARS-C18-2025",
  "primary_role": "Science Officer",
  "gender": "female",
  "nationality": "undisclosed",
  "age": "undisclosed",
  "field_of_expertise": {
    "category": "Biology",
    "detail": "Incoming PhD student and National Science Foundation Graduate Research Fellow in Plant Biology (Cornell University); research mathematically models plant root behavior under abiotic stress in space conditions such as microgravity; dual B.S. in Astrobiology and Mathematical Sciences"
  },
  "source_citation": "SRC-fmars-meet-the-crew-c17-c18, fmars.marssociety.org/meet-the-crew-2/, 'Crew 18 (Amaruq)' section, Lead Mission Specialist bio: 'The Lead Mission Specialist serves as an incoming PhD student and National Science Foundation Graduate Research Fellow in Plant Biology at Cornell University... Her research mathematically models plant root behavior... She earned dual Bachelor degrees in Astrobiology and Mathematical Sciences' (explicit 'Her'/'She' pronouns). No nationality stated.",
  "verified_by": "ASG"
}
