{
  "crew_member_id": "FMARS-C16-2024-CM02",
  "mission_id": "FMARS-C16-2024",
  "primary_role": "Medical Officer",
  "gender": "undisclosed",
  "nationality": "US",
  "age": "undisclosed",
  "field_of_expertise": {
    "category": "Medicine/Health",
    "detail": "MSc; Health & Safety Officer"
  },
  "source_citation": "SRC-fmars-c16-crew-announcement, marssociety.org 2024-06-19 'Arctic Flashline Mission is Happening Again!': 'Health & Safety Officer: [name redacted], MSc. (U.S.)'. No gender pronoun stated in the source.",
  "verified_by": "ASG"
}
