{
  "crew_member_id": "FMARS-C16-2024-CM04",
  "mission_id": "FMARS-C16-2024",
  "primary_role": "Science Officer",
  "gender": "undisclosed",
  "nationality": "GB",
  "age": "undisclosed",
  "field_of_expertise": {
    "category": "Other",
    "detail": "PhD; Chief Science Officer (specific research discipline not stated in the source)"
  },
  "source_citation": "SRC-fmars-c16-crew-announcement, marssociety.org 2024-06-19 'Arctic Flashline Mission is Happening Again!': 'Chief Science Officer: [name redacted], Ph.D. (Scotland)'. Nationality recorded as GB (Scotland is a constituent country of the United Kingdom; no separate ISO code exists for Scotland). No gender pronoun stated in the source.",
  "verified_by": "ASG"
}
