{
  "crew_member_id": "FMARS-C17-2025-CM01",
  "mission_id": "FMARS-C17-2025",
  "primary_role": "Commander",
  "gender": "female",
  "nationality": "undisclosed",
  "age": "undisclosed",
  "field_of_expertise": {
    "category": "Other",
    "detail": "Partner and Creative Director at a design and innovation firm; 20 years of experience in industrial design, futurism, and space architecture"
  },
  "source_citation": "SRC-fmars-meet-the-crew-c17-c18, fmars.marssociety.org/meet-the-crew-2/, 'Crew 17 (Silaliq)' section, Commander bio: 'Partner and Creative Director at a design and innovation firm... 20 years of experience in industrial design, futurism, and space architecture... Her work transforms theoretical concepts into tangible solutions' (explicit 'Her' pronoun). No nationality stated.",
  "verified_by": "ASG"
}
