{
  "crew_member_id": "FMARS-C16-2024-CM07",
  "mission_id": "FMARS-C16-2024",
  "primary_role": "Executive Officer",
  "gender": "undisclosed",
  "nationality": "US",
  "age": "undisclosed",
  "field_of_expertise": {
    "category": "Engineering",
    "detail": "MSc; PhD student (University of North Dakota)"
  },
  "source_citation": "SRC-fmars-c16-crew-announcement, marssociety.org 2024-06-19 'Arctic Flashline Mission is Happening Again!': 'Executive Officer: [name redacted], MSc., Ph.D. Student, UND (U.S.)'. No gender pronoun stated in the source.",
  "verified_by": "ASG"
}
