{
  "crew_member_id": "FMARS-C16-2024-CM05",
  "mission_id": "FMARS-C16-2024",
  "primary_role": "Other",
  "gender": "undisclosed",
  "nationality": "US",
  "age": "undisclosed",
  "field_of_expertise": {
    "category": "Other",
    "detail": "Crew Logistics"
  },
  "source_citation": "SRC-fmars-c16-crew-announcement, marssociety.org 2024-06-19 'Arctic Flashline Mission is Happening Again!': 'Crew Logistics: [name redacted] (U.S.)'. No gender pronoun stated in the source.",
  "verified_by": "ASG"
}
