{
  "crew_member_id": "FMARS-C18-2025-CM07",
  "mission_id": "FMARS-C18-2025",
  "primary_role": "Other",
  "gender": "female",
  "nationality": "undisclosed",
  "age": "undisclosed",
  "field_of_expertise": {
    "category": "Psychology",
    "detail": "Communications Officer; studies human cognitive behavior and the relationship between Yoga, Bharatanatyam, and circadian rhythm support during missions; completed a 21-day Lunar Mission Astronaut training program"
  },
  "source_citation": "SRC-fmars-meet-the-crew-c17-c18, fmars.marssociety.org/meet-the-crew-2/, 'Crew 18 (Amaruq)' section, Communications Officer bio: 'The Communications Officer completed 21-day Lunar Mission Astronaut training... Her studies examine human cognitive behavior and the relationship between Yoga, Bharatanatyam, and circadian rhythm support... She has authored three published books' (explicit 'Her'/'She' pronouns). No nationality stated.",
  "verified_by": "ASG"
}
